{
  "source": {
    "batch_id": "batch-001",
    "local_match_no": "002",
    "overview_path": "data/screenshots/batch-001/002-overview.png",
    "detail_path": "data/screenshots/batch-001/002-detail.png"
  },
  "match": {
    "mode": "5v5排位",
    "played_at": "2026-06-09T22:04:00+08:00",
    "duration_seconds": 918,
    "blue_score": 18,
    "red_score": 23,
    "winner_side": "red",
    "friend_side": "blue",
    "friend_result": "loss",
    "include_in_personal_stats": true,
    "include_in_pair_stats": true,
    "include_in_lineup_stats": true,
    "include_in_for_fun_stats": true,
    "exclude_reason": null
  },
  "players": [
    {
      "side": "blue",
      "slot": 1,
      "raw_name": "迪路兽oo",
      "friend_candidate": "迪路兽oo",
      "is_friend_candidate": true,
      "raw_hero": "庄周",
      "hero_id": "zhuangzhou",
      "hero_name": "庄周",
      "rating": 8.9,
      "kills": 1,
      "deaths": 3,
      "assists": 15,
      "economy": 7900,
      "damage_dealt": 31400,
      "damage_dealt_pct": 13,
      "damage_taken": 92000,
      "damage_taken_pct": 31,
      "team_economy_pct": 18,
      "participation_pct": 89,
      "medals": ["银牌游走"],
      "lane": "游走",
      "lane_source": "medal",
      "lane_confidence": "high",
      "is_mvp": false,
      "is_svp": false
    },
    {
      "side": "blue",
      "slot": 2,
      "raw_name": "别压力我ok？",
      "friend_candidate": "别压力我ok？",
      "is_friend_candidate": true,
      "raw_hero": "马可波罗",
      "hero_id": null,
      "hero_name": null,
      "rating": 10.4,
      "kills": 8,
      "deaths": 4,
      "assists": 7,
      "economy": 10800,
      "damage_dealt": 68400,
      "damage_dealt_pct": 34,
      "damage_taken": 41000,
      "damage_taken_pct": 14,
      "team_economy_pct": 25,
      "participation_pct": 83,
      "medals": ["SVP", "金牌发育路"],
      "lane": "发育路",
      "lane_source": "medal",
      "lane_confidence": "high",
      "is_mvp": false,
      "is_svp": true
    },
    {
      "side": "blue",
      "slot": 3,
      "raw_name": "鸽",
      "friend_candidate": "鸽",
      "is_friend_candidate": true,
      "raw_hero": "赵云",
      "hero_id": null,
      "hero_name": null,
      "rating": 7.1,
      "kills": 4,
      "deaths": 5,
      "assists": 9,
      "economy": 9100,
      "damage_dealt": 40600,
      "damage_dealt_pct": 20,
      "damage_taken": 65000,
      "damage_taken_pct": 22,
      "team_economy_pct": 21,
      "participation_pct": 72,
      "medals": [],
      "lane": "打野",
      "lane_source": "manual_guess",
      "lane_confidence": "medium",
      "is_mvp": false,
      "is_svp": false
    },
    {
      "side": "blue",
      "slot": 4,
      "raw_name": "净漾银笑幻",
      "friend_candidate": "净漾银笑幻",
      "is_friend_candidate": true,
      "raw_hero": "不知火舞",
      "hero_id": null,
      "hero_name": null,
      "rating": 7.8,
      "kills": 4,
      "deaths": 6,
      "assists": 8,
      "economy": 8800,
      "damage_dealt": 49300,
      "damage_dealt_pct": 24,
      "damage_taken": 37000,
      "damage_taken_pct": 13,
      "team_economy_pct": 20,
      "participation_pct": 67,
      "medals": [],
      "lane": "中路",
      "lane_source": "manual_guess",
      "lane_confidence": "medium",
      "is_mvp": false,
      "is_svp": false
    },
    {
      "side": "blue",
      "slot": 5,
      "raw_name": "月亮西沉朝阳",
      "friend_candidate": "月亮西沉朝阳",
      "is_friend_candidate": true,
      "raw_hero": "夏侯惇",
      "hero_id": null,
      "hero_name": null,
      "rating": 6.6,
      "kills": 1,
      "deaths": 5,
      "assists": 10,
      "economy": 8200,
      "damage_dealt": null,
      "damage_dealt_pct": null,
      "damage_taken": 104000,
      "damage_taken_pct": 35,
      "team_economy_pct": 16,
      "participation_pct": 61,
      "medals": [],
      "lane": "对抗路",
      "lane_source": "manual_guess",
      "lane_confidence": "low",
      "is_mvp": false,
      "is_svp": false
    },
    {
      "side": "red",
      "slot": 1,
      "raw_name": "对手1",
      "friend_candidate": null,
      "is_friend_candidate": false,
      "raw_hero": "廉颇",
      "hero_id": null,
      "hero_name": null,
      "rating": 8.4,
      "kills": 3,
      "deaths": 4,
      "assists": 16,
      "economy": 8500,
      "damage_dealt": 29800,
      "damage_dealt_pct": 11,
      "damage_taken": 118000,
      "damage_taken_pct": 34,
      "team_economy_pct": 17,
      "participation_pct": 82,
      "medals": ["银牌对抗路"],
      "lane": null,
      "lane_source": null,
      "lane_confidence": null,
      "is_mvp": false,
      "is_svp": false
    },
    {
      "side": "red",
      "slot": 2,
      "raw_name": "对手2",
      "friend_candidate": null,
      "is_friend_candidate": false,
      "raw_hero": "镜",
      "hero_id": null,
      "hero_name": null,
      "rating": 11.6,
      "kills": 9,
      "deaths": 3,
      "assists": 8,
      "economy": 11300,
      "damage_dealt": 53200,
      "damage_dealt_pct": 25,
      "damage_taken": 52000,
      "damage_taken_pct": 15,
      "team_economy_pct": 24,
      "participation_pct": 74,
      "medals": ["MVP", "金牌打野"],
      "lane": null,
      "lane_source": null,
      "lane_confidence": null,
      "is_mvp": true,
      "is_svp": false
    },
    {
      "side": "red",
      "slot": 3,
      "raw_name": "对手3",
      "friend_candidate": null,
      "is_friend_candidate": false,
      "raw_hero": "小乔",
      "hero_id": null,
      "hero_name": null,
      "rating": 9.3,
      "kills": 5,
      "deaths": 4,
      "assists": 12,
      "economy": 9300,
      "damage_dealt": 60300,
      "damage_dealt_pct": 29,
      "damage_taken": null,
      "damage_taken_pct": null,
      "team_economy_pct": 20,
      "participation_pct": 74,
      "medals": [],
      "lane": null,
      "lane_source": null,
      "lane_confidence": null,
      "is_mvp": false,
      "is_svp": false
    },
    {
      "side": "red",
      "slot": 4,
      "raw_name": "对手4",
      "friend_candidate": null,
      "is_friend_candidate": false,
      "raw_hero": "虞姬",
      "hero_id": null,
      "hero_name": null,
      "rating": 8.2,
      "kills": 4,
      "deaths": 5,
      "assists": 9,
      "economy": 9900,
      "damage_dealt": 48700,
      "damage_dealt_pct": 23,
      "damage_taken": 36000,
      "damage_taken_pct": 10,
      "team_economy_pct": 22,
      "participation_pct": 57,
      "medals": [],
      "lane": null,
      "lane_source": null,
      "lane_confidence": null,
      "is_mvp": false,
      "is_svp": false
    },
    {
      "side": "red",
      "slot": 5,
      "raw_name": "对手5",
      "friend_candidate": null,
      "is_friend_candidate": false,
      "raw_hero": "孙膑",
      "hero_id": null,
      "hero_name": null,
      "rating": 8.9,
      "kills": 2,
      "deaths": 2,
      "assists": 18,
      "economy": 7400,
      "damage_dealt": 20500,
      "damage_dealt_pct": 12,
      "damage_taken": 79000,
      "damage_taken_pct": 26,
      "team_economy_pct": 17,
      "participation_pct": 87,
      "medals": ["金牌游走"],
      "lane": null,
      "lane_source": null,
      "lane_confidence": null,
      "is_mvp": false,
      "is_svp": false
    }
  ],
  "field_confidence": {
    "friend_side": "high",
    "players[4].lane": "low"
  },
  "codex_notes": ["样例中包含 null 统计字段，用于验证待审链路不会提前要求正式入库必填项。"]
}
