{
  "source": {
    "batch_id": "batch-001",
    "local_match_no": "001",
    "overview_path": "data/screenshots/batch-001/001-overview.png",
    "detail_path": "data/screenshots/batch-001/001-detail.png"
  },
  "match": {
    "mode": "5v5排位",
    "played_at": "2026-06-09T21:46:00+08:00",
    "duration_seconds": 731,
    "blue_score": 11,
    "red_score": 25,
    "winner_side": "red",
    "friend_side": "red",
    "friend_result": "win",
    "include_in_personal_stats": true,
    "include_in_pair_stats": true,
    "include_in_lineup_stats": true,
    "include_in_for_fun_stats": true,
    "exclude_reason": null
  },
  "players": [
    {
      "side": "blue",
      "slot": 1,
      "raw_name": "对手1",
      "friend_candidate": null,
      "is_friend_candidate": false,
      "raw_hero": "亚瑟",
      "hero_id": null,
      "hero_name": null,
      "rating": 6.2,
      "kills": 2,
      "deaths": 5,
      "assists": 4,
      "economy": 6400,
      "damage_dealt": 28500,
      "damage_dealt_pct": 18,
      "damage_taken": 61000,
      "damage_taken_pct": 24,
      "team_economy_pct": 20,
      "participation_pct": 55,
      "medals": [],
      "lane": null,
      "lane_source": null,
      "lane_confidence": null,
      "is_mvp": false,
      "is_svp": false
    },
    {
      "side": "blue",
      "slot": 2,
      "raw_name": "对手2",
      "friend_candidate": null,
      "is_friend_candidate": false,
      "raw_hero": "李白",
      "hero_id": null,
      "hero_name": null,
      "rating": 7.3,
      "kills": 4,
      "deaths": 6,
      "assists": 3,
      "economy": 7100,
      "damage_dealt": 30200,
      "damage_dealt_pct": 21,
      "damage_taken": 42000,
      "damage_taken_pct": 16,
      "team_economy_pct": 23,
      "participation_pct": 64,
      "medals": ["银牌打野"],
      "lane": null,
      "lane_source": null,
      "lane_confidence": null,
      "is_mvp": false,
      "is_svp": true
    },
    {
      "side": "blue",
      "slot": 3,
      "raw_name": "对手3",
      "friend_candidate": null,
      "is_friend_candidate": false,
      "raw_hero": "妲己",
      "hero_id": null,
      "hero_name": null,
      "rating": 5.8,
      "kills": 1,
      "deaths": 5,
      "assists": 5,
      "economy": 5800,
      "damage_dealt": 24100,
      "damage_dealt_pct": 17,
      "damage_taken": 35000,
      "damage_taken_pct": 14,
      "team_economy_pct": 18,
      "participation_pct": 55,
      "medals": [],
      "lane": null,
      "lane_source": null,
      "lane_confidence": null,
      "is_mvp": false,
      "is_svp": false
    },
    {
      "side": "blue",
      "slot": 4,
      "raw_name": "对手4",
      "friend_candidate": null,
      "is_friend_candidate": false,
      "raw_hero": "后羿",
      "hero_id": null,
      "hero_name": null,
      "rating": 6.5,
      "kills": 3,
      "deaths": 4,
      "assists": 2,
      "economy": 6900,
      "damage_dealt": 33500,
      "damage_dealt_pct": 23,
      "damage_taken": 30000,
      "damage_taken_pct": 12,
      "team_economy_pct": 22,
      "participation_pct": 45,
      "medals": [],
      "lane": null,
      "lane_source": null,
      "lane_confidence": null,
      "is_mvp": false,
      "is_svp": false
    },
    {
      "side": "blue",
      "slot": 5,
      "raw_name": "对手5",
      "friend_candidate": null,
      "is_friend_candidate": false,
      "raw_hero": "蔡文姬",
      "hero_id": null,
      "hero_name": null,
      "rating": 5.4,
      "kills": 1,
      "deaths": 5,
      "assists": 7,
      "economy": 5200,
      "damage_dealt": 14500,
      "damage_dealt_pct": 10,
      "damage_taken": 87000,
      "damage_taken_pct": 34,
      "team_economy_pct": 17,
      "participation_pct": 73,
      "medals": [],
      "lane": null,
      "lane_source": null,
      "lane_confidence": null,
      "is_mvp": false,
      "is_svp": false
    },
    {
      "side": "red",
      "slot": 1,
      "raw_name": "鸽",
      "friend_candidate": "鸽",
      "is_friend_candidate": true,
      "raw_hero": "庄周",
      "hero_id": "zhuangzhou",
      "hero_name": "庄周",
      "rating": 9.8,
      "kills": 0,
      "deaths": 1,
      "assists": 18,
      "economy": 7289,
      "damage_dealt": 37200,
      "damage_dealt_pct": 12,
      "damage_taken": 78000,
      "damage_taken_pct": 23,
      "team_economy_pct": 17,
      "participation_pct": 72,
      "medals": ["金牌游走"],
      "lane": "游走",
      "lane_source": "medal",
      "lane_confidence": "high",
      "is_mvp": false,
      "is_svp": false
    },
    {
      "side": "red",
      "slot": 2,
      "raw_name": "净漾银笑幻",
      "friend_candidate": "净漾银笑幻",
      "is_friend_candidate": true,
      "raw_hero": "孙尚香",
      "hero_id": null,
      "hero_name": null,
      "rating": 11.2,
      "kills": 10,
      "deaths": 2,
      "assists": 8,
      "economy": 9600,
      "damage_dealt": 61500,
      "damage_dealt_pct": 31,
      "damage_taken": 33000,
      "damage_taken_pct": 10,
      "team_economy_pct": 24,
      "participation_pct": 72,
      "medals": ["MVP", "金牌发育路"],
      "lane": "发育路",
      "lane_source": "medal",
      "lane_confidence": "high",
      "is_mvp": true,
      "is_svp": false
    },
    {
      "side": "red",
      "slot": 3,
      "raw_name": "异想天开的球",
      "friend_candidate": "异想天开的球",
      "is_friend_candidate": true,
      "raw_hero": "澜",
      "hero_id": null,
      "hero_name": null,
      "rating": 10.1,
      "kills": 7,
      "deaths": 2,
      "assists": 10,
      "economy": 8900,
      "damage_dealt": 46800,
      "damage_dealt_pct": 24,
      "damage_taken": 41000,
      "damage_taken_pct": 13,
      "team_economy_pct": 22,
      "participation_pct": 68,
      "medals": ["银牌打野"],
      "lane": "打野",
      "lane_source": "medal",
      "lane_confidence": "high",
      "is_mvp": false,
      "is_svp": false
    },
    {
      "side": "red",
      "slot": 4,
      "raw_name": "萧瑟仙贝打我",
      "friend_candidate": "萧瑟仙贝打我",
      "is_friend_candidate": true,
      "raw_hero": "王昭君",
      "hero_id": null,
      "hero_name": null,
      "rating": 8.7,
      "kills": 4,
      "deaths": 3,
      "assists": 14,
      "economy": 7600,
      "damage_dealt": 39800,
      "damage_dealt_pct": 21,
      "damage_taken": 29000,
      "damage_taken_pct": 9,
      "team_economy_pct": 19,
      "participation_pct": 72,
      "medals": [],
      "lane": "中路",
      "lane_source": "manual_guess",
      "lane_confidence": "medium",
      "is_mvp": false,
      "is_svp": false
    },
    {
      "side": "red",
      "slot": 5,
      "raw_name": "月亮西沉朝阳",
      "friend_candidate": "月亮西沉朝阳",
      "is_friend_candidate": true,
      "raw_hero": "吕布",
      "hero_id": null,
      "hero_name": null,
      "rating": 9.1,
      "kills": 4,
      "deaths": 3,
      "assists": 12,
      "economy": 8200,
      "damage_dealt": 33200,
      "damage_dealt_pct": 12,
      "damage_taken": 86000,
      "damage_taken_pct": 45,
      "team_economy_pct": 18,
      "participation_pct": 64,
      "medals": ["银牌对抗路"],
      "lane": "对抗路",
      "lane_source": "medal",
      "lane_confidence": "high",
      "is_mvp": false,
      "is_svp": false
    }
  ],
  "field_confidence": {
    "friend_side": "high",
    "played_at": "medium"
  },
  "codex_notes": ["样例数据，用于验证 Phase 3 导入链路。"]
}
